{
  "apiVersion": "reposeal.dev/v1",
  "kind": "CapabilityManifest",
  "metadata": { "name": "example-security-review", "version": "1.0.0" },
  "identities": ["skill:example/security-review", "github:example/security-review"],
  "domains": ["example.com"],
  "dependencies": ["pypi:semgrep"],
  "permissions": {
    "filesystem": ["project"],
    "network": [],
    "environmentRead": ["PATH"],
    "shell": true
  },
  "provenance": [
    { "kind": "github-actions", "issuer": "https://token.actions.githubusercontent.com" }
  ]
}

